{
  "api_version": "agent-platform/v1alpha1",
  "kind": "ContextPolicy",
  "metadata": {
    "id": "cpo_0198f6d0-7ef0-7b0e-a0d3-5f9c96c7f411",
    "key": "development-context-policy",
    "namespace": "development",
    "version": "1.0.0",
    "revision": 1,
    "scope": {
      "type": "tenant",
      "tenant_id": "ten_0198f6d0-7ef0-7b0e-a0d3-5f9c96c7f411"
    },
    "labels": {
      "domain": "development"
    },
    "annotations": {},
    "content_digest": "sha256:a1b2c3d4e5f6a1b2c3d4e5f6a1b2c3d4e5f6a1b2c3d4e5f6a1b2c3d4e5f6a1b2",
    "created_at": "2026-09-01T00:00:00Z",
    "created_by": {
      "actor_type": "user",
      "actor_id": "usr_0198f6d0-7ef0-7b0e-a0d3-5f9c96c7f411",
      "tenant_id": "ten_0198f6d0-7ef0-7b0e-a0d3-5f9c96c7f411"
    }
  },
  "spec": {
    "source_rules": [
      { "source": "task", "effect": "allow", "priority": 100 },
      { "source": "agent_spec", "effect": "allow", "priority": 95 },
      { "source": "prompt", "effect": "allow", "priority": 90 },
      { "source": "skill", "effect": "allow", "priority": 80 },
      { "source": "tool_schema", "effect": "allow", "priority": 70 },
      { "source": "memory", "effect": "allow", "priority": 60 },
      { "source": "thread", "effect": "allow", "priority": 50 }
    ],
    "token_budget": {
      "total_tokens": 8000,
      "reserved_output_tokens": 2000,
      "per_source": {
        "task": 500,
        "agent_spec": 300,
        "prompt": 2000,
        "skill": 2000,
        "tool_schema": 500,
        "memory": 500,
        "thread": 200
      }
    },
    "skill_selection": {
      "top_k": 5,
      "similarity_threshold": 0.7,
      "metadata_token_limit": 500
    },
    "tool_selection": {
      "max_visible_tools": 10,
      "schema_token_limit": 1000
    },
    "memory_scope": {
      "allowed_scopes": ["user", "tenant"],
      "allow_cross_user": false,
      "allow_cross_tenant": false
    },
    "freshness": {
      "default_ttl_seconds": 3600,
      "source_ttl_seconds": {
        "memory": 86400,
        "thread": 3600
      }
    },
    "deduplication": {
      "strategy": "digest"
    },
    "compaction": {
      "strategy": "extractive",
      "target_ratio": 0.7,
      "preserve_provenance": true
    },
    "redaction": {
      "redact_secrets": true,
      "pii_mode": "mask",
      "restricted_data_mode": "deny"
    },
    "provenance_requirement": true,
    "snapshot_policy": {
      "persist": true,
      "store_content": false,
      "retention_days": 30,
      "require_digest": true
    }
  },
  "status": {
    "phase": "active",
    "observed_revision": 1,
    "activated_at": "2026-09-01T00:00:00Z"
  }
}
